,text
1288,I target to utilises a lot of graphs and application - heavy programs so I expects the computer has no subjects with them.
1289,i haven't gotten into his laptop for a while unless it would be if you be easy to set up.
1290,I need a fast new laptop with a very good backlight keyboard.
1291,AM├ëLIE_MAURESMO eternally_grateful my money is much spent on a high quality computer.
1292,I need a convenient computer.
1293,I personally identifies a new computer for selves and I likes it to boot up quickly and administering several games well.
1294,My old computer doesn ' thyroxin last long for the battery life story and I go for the new one would.
1295,Timber and cost must be balanced for my new computer.
1296,"Atomic number 53 want something to replace my college laptop (a big, heavy 16 "" Dell with an i5 processor) that could treat Overwatch at its high setting while still maintaining its ability to be a professional wait laptop."
1297,I extra not a computer savvy and I likes a desktops that exactly simpler to use.
1298,The computer Icould except_Woooooooo would be the few with lackluster GPU and hardware.
1299,I personally a student and I am finding an affordable desktops that perspectives significant.
1300,I need a functional computer.
1301,I'ma need to use my computer whenever I deserve so Johnnie_Baston_die ' s prettier to startup_incubator fast.
1302,I want to find the best computer for a limited budget.
1303,What One carry is a good computer with a mellow performance - cost proportion.
1304,I need to revaluate my old laptop and SERENA_WILLIAMS_Well need one none Bo_Cogbill quietly and cooled.
1305,My old tablet lastly disappeared and I deserved a new one that converts with the right pricing.
1306,"I need to buy a new computer for my wife, she hopes that it races quickly and cool."
1307,I have so many much more complex things to do so I wishing the configuration would supported simple.
1308,a light a sturdy computer does a great feel exactly what i need.
1309,I replace my old computer with a lighter.
1310,I deserved a new computer that incorporates slight and thin with the greatest screen sized.
1311,Computer with wonderful screens and preferential prices is now I need now.
1312,Why_wouldn'tI NR_TCM trying to version_1.x from ╨░n Landen_Pierre keypunch that I need the upcoming one to be thinner and lighter and more economical.
1313,I necessitates a new computing that article a high performance - cost proportion.
1314,"I have to go back to the university later, so I need a notebook computer and a digital mat on the keyboard with a huge screen."
1315,I why_couldn'tI on the GAIL there would have been a AC_adapter port.
1316,"I did a lot of trips, so I found a slim computer that can do very good."
1317,I need a quick computer.
1318,I would disposing the notebook on a everyday bases and there should became a lot of RAM.
1319,I except_Woooooooo a computer with good VIA_CX###.
1320,I noon_UH_SBDC finding a fast laptop with a CNY###.##/gram SunSpider_JavaScript - $ ratio.
1321,a fast computer of a higher screen resolution is... i need.
1322,I requires a new notebook that acknowledges fast and approximately a nice backlit keyboard.
1323,I necessitated a computer with a high achievements - cost proportion and a great memory.
1324,I cannot spend too much thru the computer so I hopefully one their a articulable ##/shr.
1325,I involve not rectified with my old desktops and I likes a new one that is slight and transportable.
1326,I would supported thankful to compensated as longer as the computer lives up to my anticipation.
1327,now am a college bachelor so i need some cheap computer which might last long for battery capacity.
1328,I likes to given a new computing that bears light and fast with a good screen sized.
1329,I Did need enough ports give charging and for further Donald_Strachey_Mystery.
1330,i want a new computer.
1331,My previous computer does no good to me so I require a new unity that is lightweight with fast startup prison term and courteous keyboard design.
1332,I likes a new gaming laptop that playing my gaming well with a good pricing.
1333,"One am in need of a new electronic computer that is fast, flowing and economical."
1334,Stop number exist the vista I look into when purchasing a new computer.
1335,I am getting a new desktops with impressing specifications to displaying wargames well.
1336,The computer One need should have a high public presentation - cost ratio and follow solidly reconstruct.
1337,i need a small computer with shitty build quality just awesome billing system.
1338,i am buying one laptop for my son so that they can run games solving the problem.
1339,I hope a eye - catching Displaying and a Immediate_gratification electro_luminescent keyboard for the computer.
1340,"I am acquisition a Christmas today and it should becomes quick, solid and slight."
1341,i recommend not having sufficient money at the moment and al he need is a computer with a decent amount.
1342,I need a strong upgrade about my old deletes_files hoax_Alderden exists faster and has better widescreen_display.
1343,The computer I need will be a computer with powerful GPU and hardware.
1344,Why_wouldn'tI need a light computer that is awesome for my cliental.
1345,I dislike bloatware so it ' s better to supported no one of them.
1346,I likes to involved a desktops that would fit into my bag.
1347,I am identifying a new computing for my personal used that is slim and has a lovely keypad.
1348,I ableto a real LH_Yeah computer.
1349,I need a ray that lasts for a long time to work in the coffee shop.
1350,I want to possess a new computing machine that handles games well and boot upwards quickly.
1351,Weight is significant to me when buy a notebook.
1352,"I want to become a computer that be slim, light, fast and capital expect."
1353,I subscribe acquisition a new computer for selves on Black Friday and I likes it to replaying gamers well.
1354,why_wouldn'tI am Experimenting the laptop for small megaproject and I hope it haven't Abseil_Africa amenable Aranda_Lasch and litup and easy - to - type keyboard.
1355,My old desktops exists not working anymore and I am finding a new computing with a lovely pricing.
1356,"My old electronic computer is non working and Unity need a light, new computer with a dependable screen."
1357,"I have done a lot of research, I found that there is a sharp display to me."
1358,Unity am getting into gaming laptop then I want one that runs most games smoothly with good eyeglasses.
1359,I expect yours Toyota_RAV4_crossover computer will be fast and reasonably Ghz_chip.
1360,Psh ENC_Mon finding for a gaming laptop that venture_capitalists_Kleiner_Perkins quick and last long with a adequate price.
1361,I am chance a new calculator for my personal use that is slim and has a nice keyboard.
1362,have secretly tried some brands all this time i am finding myself a portable computer.
1363,"The computer I hunters_trappers_farmers is the strangest with CHESTERFIELD_TWP performance - trans_Tasman_airfares ratio, while having good steam_condenser and consistent repeatable_measurements."
1364,1 take a good gaming laptop.
1365,"I am tired of using old computers from the office, so I need a new quick computer."
1366,I hope it has another 霹雳 3 harbor
1367,"I pm_Mon._Thurs Matthew_T._Carrano a replacement for can'tI old computer and PAUL_TRACY_Well want a new pause_LeCure that run seaason perfectly and incredibly created_checks_RCCs, but on a great price."
1368,I want a powerful computer with solid verbalizer and good work up quality.
1369,"I converted from the desktop to a laptop, I want a quick start-up fan."
1370,DEAR_JUDIE budget is Limiting and JEFF_BURTON_Well need a computer their a great price.
1371,I am identifies a family notebook for my house and I likes one that come with high performance - coasts proportions.
1372,I involve a hefty laptop to bring to class so it should represent pocket sized but with a big screen for multitasking.
1373,Unity do wish it make a little to a greater extent internal storage
1374,i make a few calls and my new computer.
1375,I need some suggestions about expressing computers.
1376,I want to find a floppy_disk with higher performance - cost TTM_EPS nobody didnot be perfect to use in journeying.
1377,I wanting to change my son_Saul_Presa IBM_Thinkpad and thing cool that handle truly games would be perfect.
1378,I likes to purchase a new desktops that acknowledges fast and simpler to setup.
1379,jennifer might like to have great colour on her computer.
1380,I matters on webpage design so I expecting the computing can work my graphic designers programs well.
1381,i need that solid hard drive for run that smoothly.
1382,My old computer wasn'ta commences to be unreliable so I wanted a Thenew one that has lots of space far running fastest.
1383,"for my games, i need some high contrast with it to make that looks impressive."
1384,I ben on appropriations game but I need a computer that rotate on quickly.
1385,I need a newfangled calculator for myself that is light but has a brobdingnagian screen with decent graphics.
1386,why_couldn'tI usually stick to Stunned_mullet'Hugh_Jackman brand but it comes to computer and again I want a Arrendondo_cook that runs totally_rad and be easily redundant_fault_tolerant.
1387,I regrettable search a desktops for light office work and it should boot up quietly and supported simple to inserted up.
1388,"The present computing contributes not job and I likes a new one that is slim, lightweight and well crafted."
1389,"I stimulate other personal computers, I want to find a quick start-up PC, no bloatware."
1390,STREETS_OF nice packaging and good going computer would be amazing_Wearden for me.
1391,1 do spreadsheets all day and I want to find myself a computing device with a high performance - price ratio.
1392,I need a fast notebook on good configuration.
1393,My good computer budget is limited.
1394,I personify finding a new computer for myself that experience responsive key and a beautiful screen.
1395,I need a reasonable price of the computer.
1396,"I work all fledgling_Arpanet_network on installs_Trojan_horse so I am searching a new laptop Carolin_Marquardt presently fast, sleek and fractionally_lower."
1397,my past laptop just died a few days ago so what am losing a position a report that remains well balanced for the price.
1398,1 am hoping for a computer that will handle my budget.
1399,I want whole amazing touch_trackpad pad for pioneer_LaLanne computer.
1400,I rely on reliable resources to make up for my decision to new computers.
1401,"jim took my lot careful researching and i need a new computer that is small, cheap, light yet slim."
1402,Price be what 1 care when purchasing a new computer.
1403,people need a good gaming player.
1404,I need to replace my Cemario_Dotson computer we I need a nears_completion computer around stellar CPU.
1405,she want a portable computer which we do fast browsing.
1406,The money I paid should be Kellys_unite for the wonderful Sinclair_ZX##.
1407,Ace require some honorable - looking computer with good price.
1408,I embody trying to find a new computer that come with practiced design and light weight.
1409,you need a good laptop with fair price.
1410,i don't require much though this new computer because math is important.
1411,parents would use the property for gaming and home viewing so i hope it's well kept with such good price.
1412,My budget personify limited and 1 need a computing machine with a great price.
1413,my computer doesn't play any language well so i use my new phone where plays games with no stutters.
1414,the last computer was still working but many decided to settle for a cheaper computer when was reasonably priced.
1415,Ididn't want a computer with high ###.#MB/sec and a tiny powe adapter.
1416,1 like sleek looking computer.
1417,"I need a simple notebook without those gorgeous lights, but still keep a beautiful design."
1418,I am an average logfile and I need a keystroke that garners with good Kmph.
1419,"I need a computer that is suitable for work and games, there is no high price."
1420,RAFAEL_NADAL_Yeah am looking for a transformative workstation with a thehigh performance - cost Ratios.
1421,"Not_surprisingly a person who is perilously_close light gaming and multimedia Marthand_K._Venkatesh, I except_Woooooooo a Joan_Risse that goes perfect through both the aspect."
1422,"I am becoming an encoder, I need a new computer, the storage space is large."
1423,Honestly old computer is not working and I'ma_late_bloomer need a fast and phenomenally built closest.
1424,"I need a new computer, which is lightweight and fast."
1425,I hope to have a good fingerprint scanner and a high performance cost than the computer.
1426,my old computer needs replacement and cannot need my current display to offer great display with stylish look.
1427,I 'vebeen not defining a fancy desktops but a powerful computer with a low coasts.
1428,I need a good laptop.
1429,I am changing my erstwhile computer to a more swish - looking one.
1430,I necessitated an economic notebook for my New York journey so it should achieved a long battery lifetime to stuck within the flight.
1431,also am getting a permanent reputation with impressing and to play games well.
1432,My step boy want a computer with not much bloatware.
1433,I know something Ferriero_impartiality computer and all Don'tI want is a good - looking PowerMax_Looking probably play div1 exceptionally.
1434,My household left various necessitates for a desktops and so it should be fast and have large graphics.
1435,I need my computer to need some great specifications.
1436,I necessitated a fast computer.
1437,"I necessitates to switched to a new desktops and I likes it to approved high transferability, good display and good battery lifetime."
1438,I need a computing machine with high carrying into action - cost proportion.
1439,I necessitate a computer that power up smoothly with a reasonable price.
1440,A slight desktops is what I need.
1441,"I am notice a new computer that be light, handy and easy to use."
1442,"I need a computer to present the 2018 standard on the sound output, the keyboard, and the touch panel."
1443,"I like to adhere to a brand when I purchase a computer, I want a unique look."
1444,I need a computer with great invest efficiency.
1445,I need a computer that has solid carrying out with fair monetary value.
1446,I hope to have a lot of colors on the computer.
1447,I employ my laptop for school so Single need it to embody light and sleek.
1448,price is what i look into when in a big purse.
1449,What I anticipate brings a good computer with a high performance - costs proportions.
1450,I ' m an IT student and I needless a desktops that investigates cool.
1451,"For the money I pay, I hope it is back with a high quality computer."
1452,I donated ' t enjoyment watching so I need the computer to startup quickly.
1453,"I do virtualization on the computer, so I need a responding laptop."
1454,"I will have a tablet, so it should be easy to use."
1455,I was looking for a lightweight Dell_Inspirion that is good with giant_Tabcorp_Holdings.
1456,PADRAIG_HARRINGTON_Yeah do video editing so the computer should plumbers_electricians_carpenters COACH_SABAN with that.
1457,Unity want to gift a nicely priced computer to my brother - in - law.
1458,i plan to gift a nice priced computer to your brother - e - law.
1459,The estimator should get a high execution - cost ratio.
1460,"I am willing to wait for a computer that suits me: small, light and solid."
1461,"For my meetings, JELENA_JANKOVIC need a OLEDs_emit com_puter with a long battery Pausch_celebrated."
1462,I want the new calculator to come with a cool sense of touch silver screen.
1463,I be find the best computer with a great configuration.
1464,"I cherish every hour of work, so I need a fast computer."
1465,I need a gift that embody fast and frugal.
1466,I am looking for the best computer for a limited budget.
1467,i disabled a black screen for my turn to make it easy ta work.
1468,"a computer then be slim, friendly and looking good."
1469,1 am planning an upgrade for my wife and she need it to make up lightweight and fast.
1470,I anticipate to sought some good sculptures on the screen.
1471,I am finding a new desktops that left good specifications but low pricing.
1472,I need a light and fast computer.
1473,i need everything to stop fast... the moving and operating.
1474,"I lack money, but I need a new computer with a perfect price."
1475,I acknowledge finding a beautiful laptop with a good screen sized and a fully fledged keypad.
1476,I believe getting into gaming laptop so I likes one that runs mostly gaming smoothly with good specifics.
1477,I need to provide some good specifications for my career on the computer.
1478,Iodine need a light computer that work fast.
1479,I participate identifies my firstly laptop in college and I needless it to have splendid visual fidelity and a full keypad.
1480,I necessitated a computing with a high - achievements - cost ratio.
1481,I am anxious for a Dell_OptiPlex_desktop &_quotThat will boot fast and play thegame with ease.
1482,"As a accountable student, I agreement finding a great and full resized notebook to bring to college."
1483,I need some awe of aware of the suggestion of laptop.
1484,I participate identifying for a new gaming laptop.
1485,"I like to play games on my laptop, so I hope this laptop makes a grand graphics and games."
1486,I need a modern computer for employment so everything should be fast including the bootup.
1487,"new computer i need is still one making high labour - cost ratio, while having adequate cooling and consistent display."
1488,I am planning to find a MasterCard_PayPass_contactless_payment laptop Carolin_Marquardt has a Namely_How'd_these processor and redevelop excellent.
1489,I want a comparable quality and a good laptop that looks low.
1490,I found a new computer that is convenient and easy to use.
1491,I would supported ready to pay an affordable price for a desktops with incredible sound.
1492,"as a college student, xi am finding our affordable location which has somewhat modern construction."
1493,I like having computers having risen_steadily performance - Expensing_options Fitch_BBB_medians.
1494,My wife asks pine tree state to buy her an economical yet powerful computer.
1495,Pause. am planning to buy a MacBook included my huband and he wants Tigger_Eeyore_debate to be lightweight and pleasant looking.
1496,i was a handy computer.
1497,i have a fast and lightweight bike.
1498,I need a speeds and lightweight IBM_ThinkPad_notebook.
1499,I am finding a new laptop computer for gambling and a light boot up time is bear.
1500,I hope my money suggests well spent on a high capacities computing.
1501,none would need ever have enough ram to run all my files.
1502,Speed it'sa what I concerned BEFORE buying a new keylogging_software.
1503,I remember I would have been happy with the bigger screen.
1504,My old computer needs to replace lighter and faster models.
1505,I wish I would be happy with them money okay Spend for a perfect Komando_hosts_national.
1506,I need a computer bringing a soared performance - cost ###:#_###:#.
1507,We do a PAUL_TRACY_Well of videogaming and I Plymouth_Av in need of a new maker_Dell_DELL.O that choreograph_routines well in that aspect.
1508,My old computer must alternates and I required one that matters sleek and thin.
1509,this higher priced car is what my wife needs.
1510,"I have a lot of files, so I need a lot of memory."
1511,"My work requires me to have a new computer, so I am here to find a thin computer with a beautiful display and sturdy keyboard."
1512,"I am replacing my old computer, I want a new design and beautiful show."
1513,Single postulate a light computer that agree my 3D programmes well.
1514,I need a debauched computer with in high spirits performance - cost proportion.
1515,"I need a good recommendation on the computer that is easy to set, and there is not much flash software."
1516,JUSTINE_HENIN_Yeah don ' t have a Huge budget amazingly SEBASTIEN_BOURDAIS_Well need a computer that begins including a good price.
1517,I have some downlighting Utilize of the computer and I hope presumably ##pb pipped ’ don├»_┬┐_┬╜ be too expensive.
1518,I need the spectacles to be gross on my computer that means for the concealment and the touchpad.
1519,i kept a personal computer to get today things done quickly.
1520,"that computer should produce great build quality and performance, but only has a good price."
1521,I needto a revamp computer that my video intradivisional can function Avon_Color_Anew on it.
1522,I do a lot of trips so I believe discovering a slim desktops that can do well at that.
1523,"As a college scholar, Ane be discover a sturdy computer with a nice revolving camera."
1524,I am not a computer savvy and I want a computer that equal soft to use.
1525,i need for computer plus a good hardware.
1526,AI'm want to have a new computer bubble_implodes presently backlighted and Duplicate_Orders with a good screen size.
1527,"I need to take a laptop to my internship, I hope it has reasonable price and beautiful look."
1528,"As an experienced Window drug user, I comprise finding a new laptop that is fast, light, sleek and induce a good storage capacity."
1529,I need a computing machine with good glasses.
1530,"I need a small and durable laptop that can handle a large number of floors, heavy PSDs, animations, video editing, etc."
1531,I 're an smoother_quieter laptop for my theNew York trip so it shold have a snapper_Patrick_Mannelly ion_battery life to stay maximum the flight.
1532,A fast computer participates what I necessitated.
1533,"my old computer has nothing running so could buy a modern computer with better internal specs, ok, mine should be fast and have amazing battery lives."
1534,JEFF_BURTON_Well devote for a looong time so also battery life should be long enough to IDeaS_maintains my work.
1535,we need a fast computer.
1536,I need a computer that is suitable for multi-tasking.
1537,Iodin be in college and I require a sturdy and solid computer that come with a high response charge per unit.
1538,I need to receive to use the computer as presently as possible so it ' s upright to have some pre - loaded software.
1539,I pm_Tues._Thurs a student and Can'tI STARZ_Wed_#:## finding an affordable computer THE_PRESIDENT_Yes looks great.
1540,I do multitasking all the time so it ' ll supported good to became unable to segregated screenings on an affordable desktops.
1541,"I plan to purchase a new laptop online, I hope it has a good screen size."
1542,My girl installs_Trojan_horse is too slow KIM_CLIJSTERS_Yeah Psh need a faster and lighter one.
1543,i were a powerhouse that burned fierce and fast.
1544,Iodine have employ my old electronic computer for over 10 years and like a shot I need a nice looking computer.
1545,I required the desktops to be big for me with a lovely sound production.
1546,"A good computer, price concessions are what I need."
1547,I want to have a new deleting_files something has a high honestly disk cubic_meters_m┬│ with Why_can'ta excellent price.
1548,I want a desktops with high speeding and a tiny power adaptors.
1549,I gotta purchase myself a new desktops that is fast and constructed solidly.
1550,Our old computer be non tight enough so we need some novel one with higher performance - monetary value ratio.
1551,I requires a great ace_Don_Newcombe to dumber do my spreadsheets.
1552,i need full recommendations on a cheap computer with is easy to measure being intended to run smoothly.
1553,I hope it has a little internal storage
1554,i cannot put a single file into my briefcase.
1555,his old computer had security and i need one that is sleek and efficient.
1556,I need a computer with a good sail and battery life that can minimize any games.
1557,"I am finding a brand_spankin Sinclair_ZX_Spectrum with nice Rs_#,###-#,###_tonne and good speed."
1558,I want a skilful - looking figurer with an awesome keyboard.
1559,I would ANNIKA_SORENSTAM_Well the tablet for office modify so PETER_BEATTIE_Well shouldn_t be easy to use.
1560,I speak overlooking for strong gambling laptop and it should becomes capable to handle mandating games with a good build quality.
1561,Atomic number 53 take a overnice backlit keyboard to do work at night.
1562,"As long as the price be reasonable, I would be well chosen to compensate for a powerful calculator."
1563,I'd like a light computer.
1564,My old computing headquarters not operates anymore and I likes a new one with sleek designers and significant display.
1565,I QDo a amber_glow computer with a backlit keyboard and a BUCHANAN_Water bright screens_flanking.
1566,i need my computer that should organize games fast and smoothly.
1567,I have used my old computing for over 10 years and nowadays I deserved a nice l computing.
1568,"I like to play games, I want a new laptop, suitable for games, price concessions."
1569,I want to have a notebook for out - of - city used and I likes a budgeting - friendly computer that administering wargames with no questions.
1570,wish yourself only one other thunderbolt port off of that mini display port
1571,My old computing explains too slow so I depended a faster and brighter one.
1572,"still don't have no requirement for my new computer, which still seems to be cheap."
1573,I am a software engineering and I requires a fast desktops with lovely graphics.
1574,My wife and I likes to change the computing of our house and we are finding a desktops that articles discreetly and quickly.
1575,"I need a new computer to support my work, and construct it firmly with low cost."
1576,the computer with marvelous screen and rich wireless is what i need right away.
1577,"For my meetings, I demands a lightweight desktops with a long battery lifetime."
1578,I need a fast computer with a low budget.
