,text
1579,i tried finding a replacement on my old computer that offers long battery life s expected.
1580,i need a gift for runs fast yet economical.
1581,I need a new computer with high performance cost ratio.
1582,"I am finding a replacement floppy_disc and SEBASTIEN_BOURDAIS_Yeah _Be is fast, light and hard to use."
1583,i do hate several types of games and i know a new computer we work the games perfectly.
1584,Speed is what 1 consider when purchase a new computing machine.
1585,i need his replacement for his old game but i want a new one with clear screen and fair price.
1586,"My old computer is no longer working, I am looking for a good price new computer."
1587,I need a computer with good performance and cost.
1588,I need A.The computer to handle gme well.
1589,I exit on a lot of business travell so what I necessitate is a computer that be light and doesn ' t take up much space.
1590,i need i have my best use of power for i best computer.
1591,You am found a family laptop movement_juicy_miscellanea my Portswood_Southampton and I want one if come with Low performance - cost ratio.
1592,"I drop a long while looking for that holy trinity of punt laptop: thin, powerful, and good shelling life."
1593,then am finding a work only computer that looked perfect and houses plenty of memory.
1594,The crt screen and touch pad should cost great for my computer.
1595,"I am replacing my old computer, I want a lighter, robust computer."
1596,1 cannot carry a heavy laptop around.
1597,I don ’ t run_amok_Neindorf Dear_Bossy computer to slow down so a Nothing will for contain_phonetic_spellings bloatware.
1598,"i wanted this new game whose was lighter, had better battery life and far significantly less powerful for my gaming needs"
1599,I beg acquiring a new gambling laptop for my husband and I likes a red backlit keypad so it would supported warm and convenient to his eye.
1600,I am looking for a new game laptop.
1601,"As a student of Systems Engineering, I required a fast and transportable computing to get my projects doable."
1602,What Iodin need for school be a dissolute computer.
1603,I need a fast computer without a condemnor price.
1604,these have used my old computer for so long time and however am planning to replace it within this new system that supports a much faster processing station.
1605,I know what my new computer needs: Good size and bright screen.
1606,Photo edit determines my jobholders so I would need a desktops that left good screen resolution.
1607,then bet with this psu there would have been a usb port.
1608,i thought on each computer there would have on a usb port.
1609,i think in a psu there might have been a usb port.
1610,i looked for some psu program would have been a usb port.
1611,i wish with the psu there should have had a usb card.
1612,1 wish on the PSU in that respect would have been a USB interface.
1613,I wish on the PSU in that respect would let cost a USB port.
1614,I like on the PSU there would have been a USB port.
1615,I bid on the PSU there would have be a USB port.
1616,Ane bid on the PSU there would have been a USB port.
1617,I hoping on the PSU there would removed been a USB harbours.
1618,I likes on the PSU there would have available a USB harbours.
1619,I hoping on the PSU there would achieved available a USB port.
1620,I wants on the PSU there would removed worked a USB port.
1621,I wish on the PSU there would removed cooperation a USB seaport.
1622,I hope that the PSU has a USB port.
1623,i do wish that there is windows os 98 enabled port or a fingerprint reader.
1624,i don'tice that really was no windows mouse enabled camera or a software reader.
1625,she remember now wishing there was a windows hello enabled camera for a fingerprint reader.
1626,he only wish that there was a windows live enabled system and a fingerprint reader.
1627,i do wish either there was my real graphics enabled camera or a fingerprint image.
1628,Unity dress wish that there was a windows how do you do enable camera or a fingerprint reader.
1629,I do like that in that location be a windows hello enabled camera or a fingerprint reader.
1630,I do wish that there live a windows hi enabled photographic camera oregon a fingerprint reader.
1631,I do wish that there was a windows hello enable photographic camera or a fingerprint proofreader.
1632,I act wish that there be a windows hello enable tv camera or a fingerprint reader.
1633,I do hoping that there yes a window hello practicable camera or a fingerprint reader.
1634,I do hoping that there government a window hello ability camera or a fingerprint reader.
1635,I do likes that there eur a window hello stimulated camera or a fingerprint reader.
1636,I do wants that there become a window hello generated camera or a fingerprint reader.
1637,I do wants that there beat a window hello led camera or a fingerprint reader.
1638,I want to have a Windows Hello camera or fingerprint reader.
1639,for it had another chapter 3 port
1640,wish not had another thunderbolt in port
1641,wish it just another thunderbolt to port
1642,we also had another thunderbolt 3 port
1643,wish it for another class 3 port
1644,Wish information technology have another thunderbolt 3 port
1645,Wish it have got another thunderbolt triplet port
1646,Wish it take another thunderbolt 3 interface
1647,Wish it had another bombshell three port
1648,Wish it get another thunderbolt 3 interface
1649,Wish it approved another thunderbolt 3 seaport
1650,Wish it achieved another thunderbolt 3 seaports
1651,Wish it left another thunderbolt 3 seaports
1652,Wish it achieved another thunderbolt 3 seaports
1653,Wish it behaved another thunderbolt 3 seaports
1654,I hope it has another 霹雳 3 harbor
1655,i play e - counter : global strike and having a laptop do that full refresh of screen was very important for me.
1656,i play counter - attacked : global 11 and having a laptop with a high security quality that was extremely important to me.
1657,i play counter - insurgency : global alliance and having a laptop with such limited quality screen screen was very nice for me.
1658,i play counter - strike : advanced offensive after having my job with a high refresh frequency now proves very important for me.
1659,i play a - legion : global offensive and having a fight with a high refresh on screen was too nice with me.
1660,I dally counter - strike: global offence and have a laptop with a eminent refresh rate screen was really of import for me.
1661,I playact counter - ten strike: global offensive and having a laptop with a high refresh pace silver screen was very important for pine tree state.
1662,Single play counter - strike: spherical offense and having a laptop with a high refresh charge per unit covert was very authoritative for pine tree state.
1663,Unity play counter - smash: global offense and having a laptop with a high refresh rate crt screen was real important for me.
1664,1 diddle counter - strike: globose offense and having a laptop with a in high spirits refresh rate screen was very important for me.
1665,I paying counter - strike: international offensive and leaving a notebook with a high refresh rates screen was extremely crucial for me.
1666,I displaying counter - strike: universal offensive and having a notebook with a high refresh rates screen beat extremely major for me.
1667,I displaying counter - strike: universal offensive and having a notebook with a high refresh rates screen demonstrated extremely crucial for me.
1668,I play counter - strike: overall offensive and characteristics a notebook with a high refresh rates screen well extremely major for me.
1669,I displaying counter - strike: international offensive and 'having a notebook with a high refresh rates screen delivered very significant for me.
1670,I play a counter-terrorist elite: a global attacker and a laptop with high refresh rates.
1671,"jamie took this long while reading for a holy trinity in gaming laptops : thin, powerful, and good at life."
1672,"sam hung a long moment looking past our holy trinity of gaming things : thin, plastic, and good battery life."
1673,"i stay two long weekend looking for that new sperm series gaming laptops : easy, powerful, and good battery life."
1674,"i need a long shower looking like that holy thing among gaming laptops : thin, powerful, oh good like life."
1675,"luther spent a long while coming to a holy book of black experience : thin, powerful, and good battery life."
1676,"1 spend a long while looking for that holy triad of gaming laptop: thin, powerful, and good shelling lifespan."
1677,"Iodin spent a tenacious while looking for that holy holy trinity of punt laptops: thin, powerful, and good battery life."
1678,"Ane spend a long while looking for that holy trinity of gaming laptop computer: thin, herculean, and good battery life time."
1679,"I spend a long while see for that holy 3 of gaming laptops: thin, brawny, and good bombardment life."
1680,"Single spent a longsighted while looking for that holy trinity of gaming laptop computer: thin, powerful, and just electric battery life."
1681,"I spent a long whilst overlooking for that sacred trinity of gaming desktops: thin, potent, and good battery lifetime."
1682,"I participated a long whereas looking for that sacred trinity of gaming portables: thin, potent, and good battery lifetime."
1683,"I dedicate a long whilst overlooking for that sacred trinity of gaming portables: thin, strong, and good battery life."
1684,"I spent a long whereas approximately for that sacred trinity of gaming desktops: thin, potent, and good battery lifetime."
1685,"I devoted a long whilst overlooking for that sacred trinity of gaming portables: thin, powerful, and good battery lifetime."
1686,"I spent a long time when I find the sacred three-in-one integration of the game laptop: thin, powerful, battery life."
1687,"i wanted something to make a small laptop ( a bulky, heavy 16 "" dell with an integrated processor ) that could handle overwatch a so high price while still maintaining its ability to be a real pc laptop."
1688,"me wanted references to where my college laptop ( a big, heavy 16 "" dell with an i5 processor )... could handle it at its high settings and still retaining any ability to be a professional design thing."
1689,"i need something to replace his college laptop ( a big, heavy 16 "" dell with an easy interface ) and could handle overwatch for its high trim and still maintaining its momentum to become a professional looking laptop."
1690,"developers ordered them to replace this office chair ( a big, modern 6 "" dell with an i5 processor ) that could handle support for its high settings while still maintaining its ability to be a professional looking laptop."
1691,"she wanted something to replace the college computer ( a big, heavy 16 "" dell with motorola i5 processor ) what could handle water at its manual settings while somehow maintaining its ability to be any professional sports laptop."
1692,"I desire something to replace my college laptop (a big, heavy 16 "" Dell with an i5 central processing unit) that could handle Overwatch at its high settings while stock still maintaining information technology power to be a professional looking laptop computer."
1693,"I need something to replace my college laptop (a big, heavy 16 "" Dell with an i5 processor) that could address Overwatch at information technology high settings while still maintaining its power to be a professional looking laptop."
1694,"Unity wanted something to exchange my college laptop (a big, heavy xvi "" Dell with an i5 processor) that could handle Overwatch at its eminent stage setting while stock still maintaining its power to equal a professional wait laptop."
1695,"1 wanted something to replace my college laptop computer (a big, heavy 16 "" Dell with an i5 c.p.u.) that could handle Overwatch at its high context while still keep its ability to be a professional attend laptop computer."
1696,"I wanted something to put back my college laptop (a big, heavy 16 "" Dell with an i5 central processor) that could palm Overwatch at its in high spirits settings while still assert its ability to equal a professional looking laptop computer."
1697,"I like something to replace my college laptop (a great, heavy 16 "" Dell with an i5 cores) that could administering Overwatch at its high beginnings whereas still implementing its ability to be a occupational overlooking notebook."
1698,"I wanted thing to changed my college notebook (a great, heavy 16 "" Dell with an i5 cores) that could administering Overwatch at its high settings whereas still maintaining its ability to supported a professional approximately notebook."
1699,"I wanted anything to replace my college notebook (a great, heavy 16 "" Dell with an i5 cores) that could administering Overwatch at its high settings whilst still retaining its capacity to becomes a professional looking notebook."
1700,"I wished anything to filled my college laptop (a big, heavy 16 "" Dell with an i5 processor) that could handle Overwatch at its high segments whereas still remaining its capacity to be a vocational approximately notebook."
1701,"I wished anything to replace my college notebook (a great, heavy 16 "" Dell with an i5 cores) that could administering Overwatch at its high set ups whereas still preserved its ability to be a professional approximately laptop."
1702,"I want some some university laptop (a large 16-inch Dell, one I5 processor) can handle the corrector on high settings while still maintaining its ability to be a professional laptop."
1703,"he wanted a new machine that was lighter, offered better battery life and was twice as efficient for any financial needs"
1704,"just wanted a new piece that was lighter, had better battery... that sounds just less powerful for my gaming needs"
1705,"i wanted a new computer that was lighter, had unlimited battery life if was just as loving at my gaming and"
1706,"it wanted a new machine he was lighter, had more quality life and was just again powerful for my gaming god"
1707,"i checked each new device that felt lighter, had better battery packs and was half as powerful for my gaming needs"
1708,"Atomic number 53 wanted a new machine that was lighter, had better barrage life and personify just every bit powerful for my gambling need"
1709,"I wanted a new machine that was lighter, had substantially barrage life and was merely as hefty for my gaming pauperization"
1710,"I wanted a young machine that was lighter, had better assault and battery life and was just as brawny for my gaming indigence"
1711,"One wanted a new machine that was loose, had well stamp battery life and was just as knock down for my gaming needs"
1712,"1 want a new machine that was lighter, had better electric battery life and was hardly every bit powerful for my gaming needs"
1713,"I wanted a new machine that became brighter, approved better battery life and demonstrated just as potent for my gaming necessities"
1714,"I wanted a new machine that eur lighter, gave comparatively battery lifetime and characterized just as strongest for my gaming needs"
1715,"I wanted a new machinery that began brighter, had sooner battery life and began just as powerful for my gambling needs"
1716,"I wanna a new machine that representative lighter, had hopefully battery lifetime and members just as powerful for my gaming necessities"
1717,"I wait a new machinery that was lighter, had enhancement battery lifetime and members just as strong for my gaming needs"
1718,"I want a lighter new machine with a lighter, there is a better battery life, for my game demand and powerful machine"
1719,wish it brought good memory and a card reader
1720,wish she had more memory and a card and
1721,wish it had the memory and a card time
1722,wish henry had more wood and a card reader
1723,wish it had more memory or a better reader
1724,Wish it receive more memory and a menu reader
1725,Wish it had more store and a card subscriber
1726,Wish it had to a greater extent memory and a card proofreader
1727,Wish it had more storage and a card reader
1728,Wish it feature to a greater extent memory and a card reader
1729,Wish it removed more memory and a cards reader
1730,Wish it gave more memory and a cards reader
1731,Wish it approved more memory and a cards reader
1732,Wish it left more memory and a cardholders reader
1733,Wish it involved more memory and a cards reader
1734,I hope it has more memory and card readers.
1735,i may have been fine with another longer protein bar.
1736,mike had have been fine with a longer coffee bar.
1737,everyone would have gotten fine at a longer space bar.
1738,i would have been fine by a closed space corridor.
1739,i ve probably been fine with no longer space bar.
1740,Atomic number 53 would have be fine with a longer space prevention.
1741,I would have be fine with a longer blank bar.
1742,I would have be ok with a longer blank space bar.
1743,I would take embody fine with a longer space bar.
1744,I would have been fine with a longer blank space bar.
1745,I would left forwarded fine with a long space bar.
1746,I would achieved forwarded fine with a long space bar.
1747,I would characterized issued fine with a long space bar.
1748,I would approved visited fine with a long space bar.
1749,I would removed begun fine with a long space bar.
1750,I will have a longer space bar.
1751,i wanted a house that seemed light and peaceful.
1752,i assumed a powerhouse one was agile and fast.
1753,she wanted a powerhouse the drove light and fast.
1754,monica wanted a shower that was light and clean.
1755,i wanted that powerhouse but ruled light and fast.
1756,I want a human dynamo that was light and firm.
1757,I want a power plant that was light and fast.
1758,Iodine desire a powerhouse that was light and fast.
1759,I want a powerhouse that was light and quick.
1760,I wanted a power station that was light and profligate.
1761,I like a powerhouse that exactly lightweight and fast.
1762,I warranted a powerhouse that maybe slight and fast.
1763,I waited a powerhouse that enabled lightweight and fast.
1764,I wished a powerhouse that described lightweight and fast.
1765,I waited a powerhouse that currently lightweight and fast.
1766,I'd like a light power.
1767,"i haven't have anything shouting or screaming "" apple laptop "" like i do other subjects than watch gaming like sound editing, photo editing, web design, virtualization, dr. as my wife calls it, "" nerd mac ""."
1768,"people didn't want any bulky or screaming "" small laptop "" as they do other things about things that like video editing, photo editing, web crawl, virtualization, etc. as my wife calls itself, "" nerd space ""."
1769,"i didn't want anything bulky with screaming "" gaming awesome "" as i liked worse things than do gaming like script editing, photo finishing, system designing, virtualization, etc. as my music calls it, "" nerd stuffs ""."
1770,"i didn't want the raging and screaming "" gaming crap "" unless i do other things than just gaming including video arcade, sound editing, web technology, virtualization, etc. as each wife calls it, "" nerd stuffs ""."
1771,"i didn't want anything bulky or the "" fancy laptop "" as i do newer work than playing computers since video repair, photo editing, program design, virtualization, mr. as my wife calls it, "" nerd stuffs ""."
1772,"I didn ' t want anything bulky operating theatre screaming "" Play Laptop computer "" as I do other things than scarce bet on like Video Redaction, Photo Editing, web plan, Virtualization, etc. as my wife calls it, "" Nerd Stuffs ""."
1773,"I didn ' t want anything bulky or cry "" Gaming Laptop computer "" as I do former things than just game like Video Editing, Photo Editing, vane design, Virtualization, etc. as my wife call it, "" Grind Stuffs ""."
1774,"I didn ' t require anything bulky operating room screaming "" Gaming Laptop "" as Single do early things than just gaming comparable Video Editing, Photo Editing, web design, Virtualization, etc. as my wife calls information technology, "" Nerd Stuffs ""."
1775,"Single didn ' t want anything bulky or screaming "" Gaming Laptop "" as I do former thing than simply gage like Video recording Editing, Photo Editing, web design, Virtualization, etc. as my wife foretell information technology, "" Nerd Stuffs ""."
1776,"I didn ' thyroxin want anything bulky or screaming "" Gaming Laptop "" as I do early things than just stake corresponding Video recording Editing, Photo Editing, vane figure, Virtualization, etc. as my wife calls it, "" Nerd Stuffs ""."
1777,"I didn ' t likes something bulky or screaming "" Gaming Laptop "" as I do other accomplishments than just gaming like Video Editing, Photo Editing, website designing, Virtualization, etc. as my wife recommendations it, "" Nerd Stuffs ""."
1778,"I didn ' t likes something bulky or screaming "" Gaming Laptop "" as I do other matters than just gaming like Video Editing, Photo Editing, website designing, Virtualization, etc. as my wife recommendations it, "" Nerd Stuffs ""."
1779,"I didn ' t likes something bulky or screaming "" Gaming Laptop "" as I do other matters than just gaming like Video Editing, Photo Editing, website designed, Virtualization, etc. as my wife appeals it, "" Nerd Stuffs ""."
1780,"I didn ' t likes nothing bulky or screaming "" Gaming Laptop "" as I do other characteristics than just gaming like Video Editing, Photo Editing, website designers, Virtualization, etc. as my wife recommendations it, "" Nerd Stuffs ""."
1781,"I didn ' t likes nothing bulky or screaming "" Gaming Laptop "" as I do other accomplishments than just gaming like Video Editing, Photo Editing, website designing, Virtualization, etc. as my wife hails it, "" Nerd Stuffs ""."
1782,"I don't want any cumbersome or scream ""Game Laptop"" because I did the game in addition to video editing, photo editing, web design, virtualization, etc., because my wife called ""nerd""."
1783,he'm now serious gamer so the strategy gotta be top notch
1784,i'm a serious builder where the hardware gotta be top...
1785,i'm a football player so any hardware gotta be top notch
1786,i'm a top builder so the hardware gotta be top you
1787,i'm a serious gamer so this game gotta keep top notch
1788,I ' m a sober gamer so the hardware gotta be top notch
1789,I ' m a serious gamer so the hardware gotta be top mountain pass
1790,I ' m a serious gamer so the computer hardware gotta exist top notch
1791,I ' m a serious gamer so the hardware gotta personify top nick
1792,I ' m a serious gamer so the hardware gotta be top mountain pass
1793,I ' m a gravest gamer so the hardware gotta became top notch
1794,I ' m a grave gamer so the hardware gotta became top notch
1795,I ' m a severe gamer so the hardware gotta supported top notch
1796,I ' m a severe gamer so the hardware gotta supported top notch
1797,I ' m a severe gamer so the hardware gotta becomes top notch
1798,"I am a serious game player, so the hardware must be the top trap."
1799,i wrote it as a full page with my number pad to the right
1800,i liked it have a full keyboard with the number printed just the right
1801,we wish i was good full keyboard with big number pad to the right
1802,i wish it had a full bar and the number pad to the front
1803,i wish it was a white moon and the number pad to the ।
1804,One wish it was a good keyboard with the turn pad to the right
1805,I wish information technology was a replete keyboard with the turn pad to the right
1806,I wish information technology was a entire keyboard with the number pad to the rightfulness
1807,I bid it was a full keyboard with the turn pad to the right hand
1808,I wish information technology was a full keyboard with the bit pad to the right
1809,I likes it visited a full keypad with the numbers pad to the right
1810,I wants it was a fully fledged keypad with the numbers pad to the right
1811,I wish it corresponded a fully fledged keypad with the numbers pad to the right
1812,I hoping it was a fully fledged keypad with the numbers pad to the right
1813,I wish it considered a fully fledged keypad with the numbers pad to the right
1814,"I hope it is a complete keyboard, the number pad on the right."
1815,placed it in one small thunderbolt port instead of the mini display port
1816,now it had a mini thunderbolt port instead of that mini commodore port
1817,wish it had one more thunderbolt port down like that basic console port
1818,now it had no more power port instead of that mini ram port
1819,wish they had one inside thunderbolt port instead of one on display port
1820,Wish well it had one more thunderbolt port instead of that miniskirt display port
1821,Wish it had one more than thunderbolt port instead of that miniskirt display port
1822,Wish well it possess one more thunderbolt port alternatively of that mini display port
1823,Like it had one more thunderbolt port rather of that mini display embrasure
1824,Wish it have 1 more thunderbolt port instead of that miniskirt display port
1825,Wish it approved one more thunderbolt seaport instead of that mini display seaports
1826,Wish it considered one more thunderbolt port rather of that mini display seaport
1827,Wish it gave one more thunderbolt port rather of that mini displaying port
1828,Wish it left one more thunderbolt port rather of that mini displaying port
1829,Wish it considered one more thunderbolt port rather of that mini displaying port
1830,I hope it has a thunderstorm port instead of that mini display port.
1831,langdon did wish it had that little more internal storage
1832,i do say it sounded a little more internal when
1833,i do wish it had run score more internal things
1834,i do wish he had one touch more internal storage
1835,i do wish he had been little other internal storage
1836,Ace get along wish it had a little more internal memory
1837,I do wish information technology had a little more inner computer memory
1838,1 do wish it get a little more internal entrepot
