,text
1274,"i didn't put anything bulky to the "" crash laptop "" gaming laptop do other things than just gaming like book editing, photo editing, web design, songwriting, etc. as science class calls it, "" nerd stuffs ""."
1275,"they didn'ts call it really besides any "" gaming laptop "" no i do other things than just gaming like video editing, photo modeling, web design, virtualization, etc. sometimes my wife calls it, "" nerd stuffs ""."
1276,"i didn't want anything bulky or screaming "" your laptop "" as i do with games... just things like video editing, print editing, web designing, marketing, etc. as my brother said it, "" nerd stuffs ""."
1277,"i can't want anything bulky besides just "" the laptop "" as i do other things so just gaming the video editing, photo recording, web design, xbox, i. as my wife calls that, "" nerd stuffs ""."
1278,"I didn ' t want anything bulky operating theatre hollo "" Gaming Laptop "" as Atomic number 53 do early things than just bet on like Video Editing, Photo Editing, web design, Virtualization, etc. as my wife calls information technology, "" Wonk Stuffs ""."
1279,"I didn ' t require anything bulky operating room yell "" Gambling Laptop "" as I do other thing than just gaming like Video Editing, Photograph Editing, web design, Virtualization, etc. as my wife cry it, "" Nerd Stuffs ""."
1280,"Iodine didn ' t want anything bulky oregon shout "" Gaming Laptop computer "" as Single do other things than just gaming similar Video Editing, Exposure Editing, web design, Virtualization, etc. as my wife calls it, "" Nerd Stuffs ""."
1281,"I didn ' t want anything bulky or screaming "" Gaming Laptop computer "" as I do other thing than simply gaming like Video Editing, Exposure Redaction, entanglement design, Virtualization, etc. as my wife calls information technology, "" Nerd Stuffs ""."
1282,"I didn ' t likes everything bulky or screaming "" Gaming Laptop "" as I do other matters than just gaming like Video Editing, Photo Editing, website designed, Virtualization, etc. as my wife recommendations it, "" Nerd Stuffs ""."
1283,"I didn ' t likes something bulky or screaming "" Gaming Laptop "" as I do other characteristics than just gaming like Video Editing, Photo Editing, website designers, Virtualization, etc. as my wife declares it, "" Nerd Stuffs ""."
1284,"I didn ' t likes something bulky or screaming "" Gaming Laptop "" as I do other insights than just gaming like Video Editing, Photo Editing, website designers, Virtualization, etc. as my wife appeals it, "" Nerd Stuffs ""."
1285,"I didn ' t likes nothing bulky or screaming "" Gaming Laptop "" as I do other matters than just gaming like Video Editing, Photo Editing, website designing, Virtualization, etc. as my wife characterizes it, "" Nerd Stuffs ""."
1286,"I don't want any cumbersome or scream ""Game Laptop"" because I did the game in addition to video editing, photo editing, web design, virtualization, etc., because my wife called ""nerd""."
1287,1'm a serious gamer so the hardware gotta cut extra notch
1288,my'm no serious businessman so the hardware gotta be top notch
1289,i'm no serious gamer... the hardware gotta be top damn
1290,i'm a computer gamer so the hardware gotta double my notch
1291,I ' m a life threatening gamer so the ironware gotta be top notch
1292,I ' m a dangerous gamer so the hardware gotta follow top notch
1293,I ' m a serious gamer so the computer hardware gotta represent top notch
1294,1 ' m a serious gamer so the hardware gotta follow top notch
1295,I ' m a grave gamer so the hardware gotta became top notch
1296,I ' m a severe gamer so the hardware gotta becomes top notch
1297,I ' m a gravest gamer so the hardware gotta becomes top notch
1298,I ' m a grave gamer so the hardware gotta becomes top notch
1299,"I am a serious game player, so the hardware must be the top trap."
1300,i think it was our specialized keyboard with their number pad to the right
1301,just wish it produced a full laptop with the number pad over the right
1302,probably wish people meant a full keyboard with the op pad to the right
1303,i wish it was a glass keyboard with the keys 27 to their right
1304,I wish it be a wide cut keyboard with the routine pad to the right
1305,One wish information technology constitute a full keyboard with the number pad to the right
1306,I wish it be a wide keyboard with the figure pad to the right
1307,I wish information technology was a full keyboard with the number pad to the rightfield
1308,I likes it believed a complete keypad with the number pad to the right
1309,I hoping it supported a complete keypad with the number pad to the right
1310,I likes it eur a complete keypad with the number pad to the right
1311,I wants it member a fully fledged keypad with the number pad to the right
1312,"I hope it is a complete keyboard, the number pad on the right."
1313,probably it was one more laptop port anyway of that mini display port
1314,kind of had one more thunderbolt port instead for our mini display port
1315,wish fire had one more screen port from under that mini display port
1316,if it had one more thunderbolt port instead of that software bot ।
1317,Wish it had one more thunderbolt port or else of that mini display larboard
1318,Wish it had one more than thunderbolt interface instead of that mini exhibit port
1319,Wish it had unrivalled more thunderbolt port rather of that mini display port wine
1320,Wish it had one more than thunderbolt port instead of that miniskirt display port
1321,Wish it had one more thunderbolt port rather of that mini displaying harbours
1322,Wish it had one more thunderbolt seaports instead of that mini displaying seaport
1323,Wish it left one more thunderbolt port instead of that mini displaying seaports
1324,Wish it had one more thunderbolt seaport rather of that mini displaying port
1325,I hope it has a thunderstorm port instead of that mini display port.
1326,she cannot imagine it had a little more internal storage
1327,i do wish school had a far bigger internal storage
1328,i do wish it had a little mind control to
1329,i immediately wish it sounded a little different internal storage
1330,I dress wish information technology had a little more internal storage
1331,Iodine do wish it suffer a little more internal storage
1332,Ace do wish it had a little more inner storage
1333,I make out wish information technology have a little more internal storage
1334,I do likes it representative a little more internal stores
1335,I do wants it involved a little more internal storerooms
1336,I do wants it left a little more internal warehouses
1337,I do hoping it left a little more internal warehouses
1338,I hope it has a little internal storage
1339,i like that this pc can it first have 1440p resolution is higher for this price
1340,i believe that this concept should with least have some support or higher for comfortable price
1341,i believe perhaps this pc could at least produce some resolution or screen for this price
1342,i believe that this display should at least achieve 1440p resolution of higher on this to
1343,I conceive that this personal computer should at least have 1440p resolution or higher for this price
1344,I believe that this personal computer should at least induce 1440p resolution or higher for this price
1345,I conceive that this PC should at least sustain 1440p resolution oregon high for this price
1346,I believe that this microcomputer should at least have 1440p resolution or high pitched for this monetary value
1347,I seemed that this PC should at littlest left 1440p determinations or higher for this price
1348,I believe that this PC should at largest given 1440p determinations or higher for this pricing
1349,I seemed that this PC should at largest left 1440p determinations or higher for this price
1350,I thought that this PC should at littlest have 1440p determinations or higher for this pricing
1351,I think this PC should have at least 1440 resolution or higher prices.
1352,"i needed a powerful, yet annoying voice that i had call out a meeting and open up on the conference table and not look because i thought she was showing skin from a lan party or esports event."
1353,"martha carried a powerful, yet inconspicuous machine that lucy could take at a meeting and check up on the conference subject and probably pretend like clara thought she was showing up to a lan party or esports arena."
1354,"that needed a powerful, yet inconspicuous presence that i dared take to a walk and open in on the conference and certainly not react like i believed i was walking up to a lan party or esports arena."
1355,"al needed a powerful, yet inconspicuous machine that i couldn take to a meeting and open presents on the conference table or calmly think like i thought i was end up outside a lan sports or esports event."
1356,"1 needed a powerful, nevertheless inconspicuous car that I could charter to a coming together and open up on the conference mesa and non look alike I thought I was showing upward to a LAN party or eSports domain."
1357,"I needed a knock down, yet invisible auto that One could direct to a meeting and open up on the conference board and not search like One thought I be showing upward to a LAN party or eSports arena."
1358,"I need a powerful, yet inconspicuous machine that I could take to a meeting and open up on the group discussion table and non look like 1 thought I constitute showing up to a local area network party or eSports arena."
1359,"I needed a sinewy, yet invisible machine that I could take to a meeting and open upwards on the conference table and not depend like I thought I be showing up to a local area network party oregon eSports arena."
1360,"I must a strong, yet inconspicuous machinery that I could take to a gatherings and reopened up on the conference table and not look like I believed I characterized suggested up to a LAN party or eSports arena."
1361,"I spent a strongest, yet inconspicuous machinery that I could take to a gatherings and commences up on the conference table and not look like I anticipated I existed demonstrating up to a LAN party or eSports arena."
1362,"I requires a strong, yet inconspicuous machinery that I could take to a gatherings and welcomes up on the conference table and not look like I rethinking I well indicate up to a LAN party or eSports arena."
1363,"I must a strongest, yet inconspicuous machinery that I could take to a meets and commenced up on the conference table and not look like I between I strategies illustrating up to a LAN party or eSports arena."
1364,"I need a powerful and unambiguous machine, I can participate in the meeting and open on the meeting table, it seems that I think I am showing the LAN Party or Arena."
1365,i wish it to under upgrade protection such for 1tb ssd and enhanced ram
1366,where wish it came with smaller ports such as the ssd and optional ram
1367,i wish they got some upgrade options and as 32 ssd and 32gb ram
1368,researchers believe it came for further options such as 1tb capacity and 32gb ram
1369,I Wish it follow with upgrade options such as 1TB SSD and 32gb aries
1370,Unity Wish it came with upgrade options such as 1TB SSD and 32gb random access memory
1371,Single Wish it occur with upgrade choice such as 1TB SSD and 32gb ram
1372,Iodine Wish it came with upgrade pick such as 1TB SSD and 32gb ram
1373,I Wish it matters with upgrading propositions such as 1TB SSD and 32gb ram
1374,I Wish it convened with upgrading assumptions such as 1TB SSD and 32gb ram
1375,I Wish it contributed with update selections such as 1TB SSD and 32gb ram
1376,I Wish it contested with upgrading propositions such as 1TB SSD and 32gb ram
1377,"I hope it has an upgrade option, such as 1TB SSD and 32GB RAM"
1378,"rick needed everything small for work and dinner, but huge enough to watch some gaming, preferably heavy gaming."
1379,"i needed something suitable for sex and study, one strong enough to make light gaming, even heavy gaming."
1380,"i wanted something powerful for work in travel, anything strong enough to do heavier spells, preferably heavy gaming."
1381,"i needed one small for hotels and travel, but smart enough for handle online gaming, preferably heavy gaming."
1382,"I needed something small for work and change of location, but strong enough to do light play, rather weighty gaming."
1383,"I needed something small for work and travelling, but firm enough to do light gaming, preferably toilsome play."
1384,"I need something small for work and travel, only strong plenty to dress light gaming, preferably heavy play."
1385,"I needed something small for workplace and travel, just substantial enough to do low cal gaming, preferably heavy gaming."
1386,"I needed thing small for workstations and trips, but strong sufficiently to do light game, preferably heavy game."
1387,"I needed anything small scale for works and travelling, but strong sufficiently to do light games, preferably heavy gaming."
1388,"I needed something small for workers and travel, but robust sufficiently to do slight game, preferably heavy gambling."
1389,"I mandated anything small for workloads and travelling, but strong sufficiently to do light gambling, preferably heavy gaming."
1390,"I need some small work and travel, but I am strong enough to do light games, it is best to be heavy."
1391,i wish they could come through at least a 500gb cpu since the space on me will already filled up soon
1392,i wish they did come in maximum rest about 500gb ssd since the space on this will be filled soon soon
1393,you wish it did come with at least a 500gb ssd then a space or top will be filled up and
1394,i wish it did even with at only a 500gb ssd since your charge on this will have filled sometime soon
1395,I wish it make come with at least a 500GB SSD since the space on this will personify take up presently
1396,Ace wish it did come with at least a 500GB SSD since the quad on this will be filled upwards before long
1397,I wish information technology did come with at least a 500GB SSD since the space on this will be filled up soon
1398,One care it did come with at least a 500GB SSD since the space on this will be filled improving soon
1399,I likes it doc sourced with at littlest a 500GB SSD since the space on this will be accommodated up shortly
1400,I hoping it don mentioned with at largest a 500GB SSD since the space on this will becomes filed up soon
1401,I likes it did derived with at littlest a 500GB SSD since the space on this will became complements up quickly
1402,I wants it did assumed with at largest a 500GB SSD since the space on this will becomes accomplished up shortly
1403,I hope that it has at least one 500GB SSD because it will fill it quickly.
1404,"i'm a software designer, so i need one computer machine would handle my daily task, and gamers can usually fulfill this requirement."
1405,"she'km a serial developer, so gotta own a fast machine to do the actual work, and the notebooks usually fits this requirement."
1406,"she'ave a software developer, so we need a fast machine to complete me own work, although gamers have usually fits this requirement."
1407,"i'm every software developer, so i create extremely fast servers that do their daily work, and designing notebooks similarly fits this requirement."
1408,"I ' m a software developer, so Ace need a immobile car to coiffure my daily work, and gamers notebooks usually fits this prerequisite."
1409,"Unity ' m a software developer, so I postulate a fast machine to make my daily work, and gamers notebooks ordinarily fits this requirement."
1410,"Iodin ' m a software developer, so 1 take a firm machine to make out my casual work, and gamers notebooks usually fits this requirement."
1411,"I ' m a software developer, so I need a fast machine to do my daily work, and gamers notebooks commonly fits this necessary."
1412,"I ' m a software developer, so I necessitated a fast machinery to do my day to day workloads, and games notebooks generally corresponds this requirement."
1413,"I ' m a software developer, so I required a fast machinery to do my day to day workers, and games notebooks ordinarily accommodates this requirement."
1414,"I ' m a software developer, so I necessitates a fast machinery to do my day to day working, and games notebooks generally accommodates this requirement."
1415,"I ' m a software developer, so I necessitated a fast machinery to do my day to day workers, and games notebooks normally fills this requirement."
1416,"I am a software developer, so I need a quick machine to do my daily work, and the game player laptop is usually suitable for this requirement."
1417,i was sent for a working laptop that is good for me.
1418,i said looking for a lightweight laptop thing is good for business.
1419,you was looking for a portable laptop that is good when gaming.
1420,i was looking for one lightweight laptop that is good to business.
1421,I was looking for a lightweight laptop computer that is good for gaming.
1422,I was looking for a lightweight laptop that is good for gage.
1423,I was looking for a lightweight laptop computer that is honorable for gaming.
1424,I follow seem for a lightweight laptop that is good for gaming.
1425,I established l for a lightweight laptop that enables good for gaming.
1426,I demonstrated looking for a lightweight notebook that e good for gaming.
1427,I gotta looking for a light notebook that is good for gaming.
1428,I nothing overlooking for a lightweight notebook that is good for gaming.
1429,I am looking for a lightweight laptop that is suitable for the game.
1430,grace was searching for a laptop had might handle her needs for gaming and maintain the battery life and take all the go to do school work
1431,kids think searching for some laptop that would save student needs for gaming that reduce the battery life others take on the go to do school work
1432,they lived never without a laptop but would meet my needs for gaming and have the battery power to take on the task to do my work
1433,i was searching for a life that would accomplish my goals without gaming and without the battery needed to take on on go to a school work
1434,I was searching for a laptop that would match my need for gaming and get the stamp battery life to take on the go to suffice school day work
1435,I was searching for a laptop that would fit my need for gaming and have the battery sprightliness to take on the cristal to make school work
1436,I was searching for a laptop computer that would meet my indigence for gaming and have the battery aliveness to take on the go to do shoal work
1437,I be searching for a laptop that would encounter my motive for gaming and have the battery life to take on the go to make schoolhouse work
1438,I very examination for a notebook that would meet my requirements for games and achieved the battery life to take on the go to do classrooms workers
1439,I was reaching for a notebook that would meet my needed for game and involved the battery lifetime to take on the go to do academies workplaces
1440,I was exploring for a notebook that would meet my essentials for game and approved the battery lifetime to take on the go to do classrooms working
1441,I currently investigating for a notebook that would meet my needs for gambling and removed the battery lifetime to take on the go to do classrooms workstations
1442,"I am looking for a laptop that meets my needs, and has battery life to accept school work."
1443,it would's been less impressive if the keyboard that thought slightest bit more at distance.
1444,we would've become really impressive if the keyboard that allowed few less more travel distance.
1445,it would've been really impressive if a mark that a small bit better than distance.
1446,it would've looked really fun giving this ship that a little bit more travel distance.
1447,It would ' ve been actually impressive if the keyboard that a lilliputian bit more travel aloofness.
1448,Information technology would ' ve be really impressive if the keyboard that a little piece to a greater extent travel distance.
1449,It would ' ve been really telling if the keyboard that a little bit more travel space.
1450,It would ' ve been really telling if the keyboard that a minuscule moment more travel distance.
1451,It would ' ve described real impressive if the keypad that a little bit more travelling telecommunications.
1452,It would ' ve begun genuinely impressive if the keypad that a little bit more travelling differences.
1453,It would ' ve worked genuinely impressive if the keypad that a little bit more travelling differences.
1454,It would ' ve supported truly impressive if the keypad that a little bit more travelling telecommunications.
1455,"If the keyboard is a bit travel distance, it will be very impressive."
1456,she could've been really nice if it had multiple slots within the table.
1457,she could've been extra nice and it had double steps for the storage.
1458,it i've was really nice... it had double slots for power storage.
1459,it couldn've been really nice if it contained double slots for five kids.
1460,Information technology could ' ve been genuinely nice if it had double slots for the storehouse.
1461,Information technology could ' ve been really decent if it receive double slots for the storage.
1462,Information technology could ' ve been really nice if information technology had double slot for the storage.
1463,Information technology could ' ve been really nice if it take double slots for the store.
1464,It could ' ve existed truly lovely if it gave double slots for the storage.
1465,It could ' ve cooperation really lovely if it had doubles slots for the warehouses.
1466,It could ' ve been truly lovely if it involved doubles slots for the storage.
1467,It could ' ve characterised exactly lovely if it ha double slots for the storage.
1468,"If it has a double slot for storage, it may be really good."
1469,anything couldn'ee been useless if it went with the ethernet usb connector and the usb type c charger
1470,it would've been fine if it arrived with the ethernet usb bus and the small mini o charger
1471,it might'd been great had she came for the ethernet usb connector and the usb type c charger
1472,i would've been great except it came with an ethernet usb dongle and the system connect c and
1473,information technology would ' ve been great if it derive with the Ethernet USB dongle and the USB type C charger
1474,it would ' ve been great if information technology came with the Ethernet USB dongle and the USB character C charger
1475,it would ' ve been peachy if information technology came with the Ethernet USB dongle and the USB case Snow charger
1476,information technology would ' ve been great if information technology came with the Ethernet USB dongle and the USB type C charger
1477,it would ' ve characterized significant if it derived with the Ethernet USB dongle and the USB characteristics C charger
1478,it would ' ve established large if it matters with the Ethernet USB dongle and the USB characteristics C charger
1479,it would ' ve labeled significant if it occupied with the Ethernet USB dongle and the USB characteristics C charger
1480,it would ' ve issued significant if it outcome with the Ethernet USB dongle and the USB characteristics C charger
1481,"If you have an Ethernet USB dagger and a USB type C charger, it will be great"
1482,"i run several motion tests, so i need another fast phone with an embedded gpu."
1483,"i run nine cuda machines, so we found the fast machine for an nvidia gpu."
1484,"he like hard cuda workloads, as i need more fast processor like an nvidia gpu."
1485,"i run early on workloads, so i need our fast car with an easy desktop."
1486,"I run hard Cuda workload, so I need a fast automobile with an NVIDIA GPU."
1487,"1 run hard Cuda workload, so I necessitate a libertine machine with an NVIDIA GPU."
1488,"I lean hard Cuda workloads, so I ask a fast car with an NVIDIA GPU."
1489,"Atomic number 53 die hard hard Cuda workload, so One need a fast machine with an NVIDIA GPU."
1490,"I run hard Cuda work, so I required a fast machinery with an NVIDIA GPU."
1491,"I run hard Cuda workflows, so I requires a fast machinery with an NVIDIA GPU."
1492,"I run hard Cuda workflows, so I requires a fast machinery with an NVIDIA GPU."
1493,"I run hard Cuda work, so I demands a fast machinery with an NVIDIA GPU."
1494,"I ran a hard drive workload, so I need a quick machine with NVIDIA GPU."
1495,nick was looking into something powerful but small and thin. this vehicle satisfied those expectations.
1496,everyone was hungry for something bright but small very thin. this ultrabook fulfills those goals.
1497,i was looking for plenty powerful but small enough thin. this ultrabook fit my needs.
1498,i was looking for something powerful yet pure and simple. everyday life fulfills those characteristics.
1499,One was bet for something powerful but small and slight. This Ultrabook satisfy those characteristics.
1500,Iodine was looking for something potent merely small and thin. This Ultrabook fulfill those characteristics.
1501,I was looking for something potent but small and lean. This Ultrabook fulfills those characteristics.
1502,I be search for something powerful but little and thin. This Ultrabook execute those characteristics.
1503,I was approximately for thing potent but small and thin. This Ultrabook accommodates those topics.
1504,I was approximately for thing powerful but small scale and thin. This Ultrabook delivers those trappings.
1505,I began looking for anything powerful but small scale and thin. This Ultrabook adheres those features.
1506,I became approximately for anything powerful but small scale and thin. This Ultrabook undertakes those characteristics.
1507,I am looking for powerful but small things.This Ultrabook satisfies these features.
1508,i wish the control points were every tad bit more sensitive
1509,i wish the fingerprint test got a tad or more sensitive
