,text
659,I am looking for a nice computer with a low price for everyday use.
660,I usually stick to one brand when it comes to computer and now I want a computer that runs cool  and be easily upgradable.
661,My old computer has run solidly for eight years and I need a new one with a great price.
662,I am buying something from the Black Friday Bargain and I want a new computer that comes with good picture and good sound quality.
663,I took it seriously on typing experience so I need a well sized keyboard that is easy to type on.
664,I would use the computer with my children so I need it to be light and sturdy.
665,I am finding the best computer for my money.
666,I am a student and I need a recommendation for a lightweight and thin computer.
667,I am finding a computer for myself that show vivid colours and brightness.
668,I need a handy computer.
669,"I focus on the appearance of a laptop that it should be sleek, nice looking and light."
670,I am getting a new tablet for my online college so I need a big screen and a nice pen.
671,I would have the tablet for office use so it should be easy to use.
672,My son has some suggestion for me on the new computer and all I want is a big screen.
673,I want to try something new that come with a cool touchscreen and sturdy hinges.
674,I am finding myself a new laptop that is cheap and fast.
675,I would carry my computer around so it would be great to be thin.
676,I am in need of a new computer that comes with great battery.
677,I draw on my tablet so a style pen is a must.
678,I need an economical laptop for my New York trip so it should have a long battery life to stay within the flight.
679,I need to get my things to be done quickly so a fast update is necessary.
680,I want to have a new computer that is easy to setup and produce good sound.
681,"I will be using the laptop for work so it should be sleek, lightweight and easy to setup."
682,I need a nice looking computer.
683,I don't have a large budget so I need a computer that comes with a nice price.
684,I am lacking money but I need a new computer that comes with a perfect price.
685,I need a gift that is fast and economical.
686,I want a new computer that comes with a high performance-cost ratio.
687,I am buying a laptop for my daughter and she wants it to be lightweight with a high performance-cost ratio.
688,I don't mind spending more money for a good computer.
689,I am a software developer and I am finding a new computer that can run IDSs with no glitch in a low cost.
690,I need some recommendations on a cheap computer which is easy to use and able to run smoothly.
691,I want a fast computer with a reasonable price.
692,I care about gaming experience so I want a computer that play games with no problem.
693,I am not finding a fancy computer but a powerful computer with a low cost.
694,Speed is what I concern when purchasing a new computer.
695,I am finding a new computer with amazing boosted frequency and useful amount of RAM.
696,I do basic business application on my laptop so I need sufficient amount of RAM and large drive of my data.
697,I look into many reviews and all I want is a computer that is hast and cheap.
698,I need to replace my old computer so I need a new computer with excellent CPU.
699,I work on webpage design so I hope the computer can work my graphic design programmes well.
700,I need a new computer that is fast and well priced.
701,My old computer isn't working so I need a new computer which is fast and responsive.
702,I want to change my old computer and I need a new one with a reasonable price.
703,I don't have much money so I need a new computer with a good price.
704,I need a fast computer.
705,My old computer is too slow so I want a new one.
706,I want to get to use the computer as soon as possible so it's better to have some pre-loaded software.
707,I want a faster computer than my old ones.
708,I need a replacement for my recently died computer and I want it to be easy to setup the new computer.
709,I need to change my old business laptop and I am finding a model with a smooth keyboard and a nice look.
710,I am irritanted with the other PCs and I want to find one that startup fast with no bloatware.
711,"I don't do gaming so I just need a nice, clear touchscreen."
712,I need a work horse that is light and quiet and easy to use.
713,I am changing my old computer and I want a new one that is faster and more economical.
714,A fast computer with a responsive touchscreen is what I need.
715,I want an economical and fast computer.
716,My old computer needs replacement and the new one should come with good speakers and video quality with a low cost.
717,I am waiting for my husband to buy me a lightweight computer that has the perfect size.
718,My old computer doesn't work for me anymore so I need a new one with decent touch screen and sound.
719,I need a fast computer.
720,I want something that is simple to use because I don't know much about laptops.
721,I need the computer to be big for me with a nice sound output.
722,I need the laptop to look much as a PC so it should have a full keyboard and a good touchscreen.
723,I do a lot of research before buying a new laptop and I want it to be fast and easy to setup and use.
724,I need a real fast computer.
725,I want to purchase a new computer that is fast and easy to setup.
726,I am finding a fast computer that runs smoothly.
727,I have always been hoping to have a fast computer with a backlit keyboard.
728,"My old computer needs replacement and the new one should come with a big screen, sleek design and wonderful keyboard lighting."
729,I know what I need for my new computer: good size and bright screen.
730,I need a new notebook and I want it to be light and easy to use.
731,I am new to laptop and I need a laptop that has a good touch screen and a big hard drive but a good price.
732,A good touch screen should be installed on my new computer.
733,I want a computer that is lightweight and fast.
734,I want to replace my old computer that I want one which runs fast and silently.
735,Speed is what I concerned when buying a new computer.
736,I am not a computer savvy and I want a computer that is easy to use.
737,I need a Christmas present for my girlfriend and she wants a laptop that boot up fast and can be set up easily.
738,I use laptop to watch movies so a large screen and clear pictures are necessary.
739,We are finding a new computer with a reasonable price.
740,I have to do homework at night so it's better to include a backlit keyboard.
741,Our homeschooled kids need some computers with large screen for learning.
742,I am finding a fast laptop with a high performance-cost ratio.
743,My old laptop needs replacement and I need a new one that has beautiful laptop design and accommodating screen size.
744,I am considering to change my old computer and the new one should be sleek.
745,I need a new laptop that is fast and has a nice backlit keyboard.
746,I need a low priced mechine that is easy to setyp and sound greatly.
747,My old computer is not working and I need a new with good size and colour.
748,I focus on the design and I want a good looking computer.
749,I am looking for a Mother's Day present that is easy to setup.
750,I need a fast computer
751,My old computer doesn't work for me anymore and I need a fast one with lots of space.
752,"For an everyday use computer, I need it to have good colour with great price."
753,I need a new computer that is easy to setup with a high performance-cost ratio.
754,"I am finding a replacement for my old computer and the new one should be light, solid and has a long battery life."
755,I am in need of a new computer that is sleek and compact.
756,I want to change my old computer and I am finding a new one that is nice looking and has nice backlit keys.
757,I need to bring my computer to school so I hope it would be lightweight.
758,"I am planning to buy a new laptop and I want to new one to be silent, lightweight and easy to use."
759,My old computer isn't working and I need to find a new one that is sleek and light.
760,I need a good keyboard for my typing work.
761,"I want to have a new computer for myself and I need to to be sleek, light and easy to use."
762,I am findinging myself a better computer with competitive specs and budget price.
763,I need a stylish computer for my work.
764,"As a college student, I need a computer that has a large memory and high speed."
765,I am looking for the best computer with the best price.
766,I need a computer that is light and lasts long for me to work at the coffee shop.
767,I have limited budget for a good computer.
768,My girlfriend needs a computer that has a good design and a high performance-cost ratio.
769,I need a computer with good processor.
770,Quality and price must be balanced for my new computer.
771,I am currently running out of savings but I want a nice computer with a nice price.
772,I want to save my money for a good computer.
773,My wife and I want to change the computer of our home and we are finding a computer that works quietly and fast.
774,My computer just recently broke down so I need a new computer immediately.
775,I recently need a new computer that comes with high speed and minimal bloatware.
776,I need a computer to write my master's papers so I need it to be light and portable to take it around.
777,I am trying to find a new computer that comes with good design and light weight.
778,I need a fast computer.
779,I like computer that feels classy and sleek.
780,I don't have much money so I would need a computer with reasonable price.
781,The computer should have a high performance-cost ratio.
782,I have some expectations on my new computer that it should have a good processor with enough RAM.
783,I am finding the best computer that worth my money.
784,I don't have much requirement for my new computer.
785,I often stick on to one brand and this time I am finding a laptop that is light and has a good keypad.
786,My old computer needs replacement and I want a new one that has a nice screen and good keyboard.
787,"I tend to choose brand with good reputation and I want a sleek, new computer that comes with the perfect size and a ergonomic keyboard."
788,I want a computer with good performance and low cost.
789,I hope the price would be reasonable for a good computer.
790,Our mechanic said he needs a laptop that has a high performance-cost ratio.
791,I won't expect too much for my new computer but a high performance-cost ratio is a must.
792,I have got a lot of documents from my work so I need a new computer that can store all those files with a reasonable price.
793,"It would be pleasant to have been able to use the computer as soon as possible, so it should be easy to set up."
794,I am taking the laptop to school so I want it to be light.
795,I want the computer to run fast while I am at school.
796,"Out of all the features, colour is the aspect that I pay most attention on."
797,I think the design of a computer do pay attribute.
798,I am going to buy a new laptop online and I want it to have a good screen size.
799,I need big keys for my big fingers.
800,I want to buy a new laptop so I can share it with my wife.
801,I have so many much more complicated things to do so I hope the setup would be easy.
802,I would like to have a new computer that has great colours.
803,I spend long time working on document so it's good to have a non-glare screen.
804,I like computer with nice colour.
805,I need an inexpensive device for school.
806,My wife asks me to buy her an economical yet powerful computer.
807,"My old computer is not working anymore so I need a cheap, pretty, new computer."
808,I want to buy a new gaming laptop for myself that play games well and have a large storage.
809,I hope my money is well spent on a powerful computer.
810,I am finding a fast computer with an awesome screen.
811,I have some light use of the computer and I hope the price won’t be too expensive.
812,I think design is important to a computer.
813,I would like to have great colour on my computer.
814,I like computers with beautiful colour and large screen.
815,I am a student and I am finding an affordable computer that looks great.
816,I am not having much money at the moment and what I need is a computer with a reasonable price.
817,I need to take my computer to school so it's better to be lightweight.
818,I need a replacement for my old laptop and I want a new one with good screen and nice price.
819,I want a computer that is well designed.
820,"I like things that are good looking, my new computer should not be left out."
821,I need a computer that powers up smoothly with a reasonable price.
822,I don’t have much money so I need a computer that comes with a great price.
823,I am saving money so I want a well priced computer.
824,I like computers with sleek design.
825,I hope my money is well paid for a high performance computer.
826,I am finding a fast computer.
827,I bring my laptop everywhere I go so I would like it to be sleek and lightweight.
828,I do multitasking all the time so it'll be good to be able to split screens on an affordable computer.
829,I do basic browsing and I am finding a cheap computer which comes up with the performance.
830,I would need large storage for my files.
831,I wish the computer would perform greatly in images.
832,I am finding the best computer with my limited budget.
833,I am buying the computer for my family so I need a nice screen to protect their eyes.
834,"I am a writer and I am looking for a computer that is fast, quiet and lightweight."
835,I am finding a new gaming computer for myself and I want it to be fast and upgradeable.
836,A backup laptop is needed and I hope it comes with great specs with low cost.
837,I am getting into gaming laptop so I want one that runs most games smoothly with good specs.
838,I want to have a laptop for out-of-town use and I want a budget-friendly computer that handle games with no issue.
839,"I am finding a replacement for my old computer and I want a new one that run games perfectly and incredibly fast, but with a great price."
840,I am not really a gamer but I need a computer that is fast and economical.
841,The computer I want should look cool and own a nice graphic card.
842,I am new into computer gaming and I want something that runs smoothly with reasonable price.
843,I play lots of games and I'm finding a new computer that run fast of all my games.
844,I want to buy a new computer for gaming so I want it to download games quickly.
845,I am buying a new computer for my wife and so the computer should play games with no problems.
846,I am finding a computer for myself that is speedy and easy to setup.
847,My old laptop is not working and I am finding a new one that has good amount of RAM and storage.
848,I am in need of a new computer that has a good processor and a practical appearance.
849,I plan to have a great bargain on a new computer.
850,I only have simple needs on my laptop so it just has to be lightweight and economical.
851,Illuminated keyboard seems cool to me.
852,I use my laptop for school so I need it to be light and sleek.
853,I am looking for a new computer that comes with a high performance-cost ratio.
854,My old computer doesn't work for me anymore and I am finding a new one with terrifc specs in a great price.
855,I haven't been using a laptop for a while and it would be good to be easy to set up.
856,I need a functional yet inexpensive model.
857,My old computer doesn't last long for the battery life and I hope the new one would.
858,Speed is important to me when purchasing a new computer.
859,I would like to have a sleek design for my next computer.
860,I would look into the specs the computer comes with so it should have a large hard drive and a decent RAM.
861,I want a nice matte finish on my new computer so no fingerprints would be attached to it.
862,I am finding a nice computer that would fit my budget.
863,I do a lot of typing at night so a backlit keyboard would help me a lot.
864,I have limited budget so I need a new computer with great price.
865,I am finding myself a new computer that is light and come with nice size.
866,I am in a nursery school and I use my laptop several hours a day.
867,I am getting a new computer for myself and I need it to be good looking with a great price.
868,I am replacing an old computer and the new one should come with great price.
869,An adequate screen should be installed on the computer.
870,Speed is what I look into when purchasing a new computer.
871,I need a computer that is easy to setup and come with a high quality monitor.
872,I am finding a new computer that would startup quickly.
873,I am using the computer for work so I need it to be fast and have bright colours.
874,I want to change my old computer and I want a fast computer with reasonable price.
875,I need a light and fast computer with a high-resolution screen.
876,I want a good-looking computer with an awesome keyboard.
877,I need a light computer.
878,I want a light laptop which can startup fast.
879,A thin and light computer is preferable.
880,A nice packaging and good looking computer would be nice for me.
881,The computer should be light.
882,I want a light computer but it should have a large screen.
883,The computer I will be using should be light and have thin edges.
884,I need a new laptop for grad school and it should be fast and sturdy and great looking.
885,"My old computer needs replacement and I want the new computer to come with a quiet keyboard and well spaced, sized keys."
886,I am a performance ethusiatist and so an awesome processor is a must.
887,I am planning an upgrade for my wife and she needs it to be lightweight and fast.
888,"For my meetings, I need a light computer with a long battery life."
889,I want to have a new laptop that is lightweight with a great battery.
890,"We need a perfect mobile business laptop and it should be quick, light and thin."
891,I need a light and fast computer.
892,My old computer is too heavy and doesn't last long so I need a new one.
893,"I am in need of a new computer with good build quality, screen and keyboard."
894,I am trying to change my perfence in branding and I need a light computer.
895,"I go to work via public transportation so it's important for me to have a compact, thin and light laptop."
896,I need a strong upgrade from my old computer that is faster and has better screen.
897,"I did a lot of researching and I need a new computer that is fast, cheap, light and slim."
898,My old laptop isn't working very well and I need a new one that comes with a good price.
899,I will do research on the specs and I need a computer that bootup fast and silently.
900,I am looking through the recommendations on Amazon and want to find myself a quick computer.
901,I need a new computer for myself that is lightweight and fast.
902,My old computer was on fritz so I need a new computer that is quick and easy to setup.
903,I am trying to upgrade from an old computer that I need the new one to be thinner and lighter and more economical.
904,"I am starting my graduate school and I need a laptop that is thin, light and has a great screen display."
905,I am finding something new to replace my old computer that has a higher portability and better display.
906,I am not into waiting so I need a computer that do fast bootup.
907,I read a lot of reviews and I decided I would buy a computer that is fast with a budget price.
908,I am looking for a new computer that is lightweight and good looking.
909,We need a new laptop for CCTV management and it should bootup fast and have a good battery life.
910,I need a fast computer.
911,I try to stick to one brand and I am finding a new one with a crisp screen and fast CPU.
912,I am using the laptop for internet surfing as I need it to be lightweight and easy to setup.
913,I need a definite improvement from my old laptop and I want to be fast without much bloatware.
914,I need a light computer with a good screen.
915,I need everything to be fast including the startup and operating.
916,My old computer is not working and I need a new one that bootup fast.
917,I am finding myself a new computer that has an amazing screen with a high performance-cost ratio.
918,"I need a new laptop for work and it should be affordable, fast and sleek."
919,I am looking for a new computer that has a sharp screen and a fast hard drive.
920,My old computer is not working and I am finding something that is fast and lightweight.
921,Screen is the most important element to me so I want it to be sharp.
922,I am finding a travel laptop for my trip and it must be light and has an amazing battery life with a tiny charger.
923,I need a computer for everyday use that comes with a high performance-cost ratio.
924,I use a laptop when I go to school and I need a fast one.
925,I did a lot of research and found out having a sharp display is critical to me.
926,I need a lightweight and cool looking computer for work.
927,I have limited budget and I am finding a computer with fast fingerprint sensor and awesome battery life.
928,I am looking for recommendation on a fast computer with fantastic price.
929,My old computer needs replacement and I need the new one to have great display and stylish look.
930,I need a light computer that is perfect for my business.
931,A computer with marvelous screen and good price is what I need right now.
932,I am in need of a new computer that is fast and slim.
933,I don't enjoy waiting so I need the computer to startup fast.
934,I need the processor to be fast and responsive on my next computer.
935,I would like to have a light and fast computer.
936,I need a great computer for work that comes with a high performance-cost ratio.
937,I need a worthy computer with nice configuration.
938,I am finding the best computer with a great configuration.
939,What I need for school is a fast computer.
940,A computer with a high performance-cost ratio is what I want.
941,I am a teacher and I need the computer to look top notch.
942,My old computer is too slow and heavy so I need a new one.
943,I need to use my computer whenever I want so it's better to startup fast.
944,"I need a different computer from my current computer, which is slow and heavy."
945,I don't want to carry a heavy mechine around.
946,I need a computer with a high performance-cost ratio.
947,I need a replacement computer that would run mush faster.
948,Our old computer are not fast enough so we need some new one with higher performance-cost ratio.
949,I am learning a lot about processors recently and I am finding myself a fast computer with a high performance-cost ratio.
950,I would use the laptop on a daily basis and there should be a lot of RAM.
951,I need the computer to boot up fast to meet my needs.
952,"I need a new work station that is fast, light and good looking."
953,A computer which can quickly download stuff is which I need.
954,I want a computer with high speed and a tiny power adapter.
955,I need a fast computer.
956,"The computer I want should startup fast, cool and quietly."
957,I am finding a new computer for myself.
958,I am in need of a new computer that is responsive and snappy.
959,I would be grateful to pay as long as the computer lives up to my expectation.
960,"As long as the price is reasonable, I would be happy to pay for a powerful computer."
961,A fast computer with a great price would be what I want.
962,My old computer is still going on well but I decided to go on with a new one with a longer battery life.
963,My old computer needs replacement and I am finding for a new computer that run games well and is easily upgradable.
964,My old computer is starting to be unreliable so I need a new one that has lots of space yet running fast.
965,The display must be incredible on my new computer.
966,I was looking to upgrade my old computer but eventually I decided I would just find a new computer that is more upgradable.
967,My old computer is not working anymore and I am finding a new computer with a nice price.
968,I don't want to have much bloatware on my computer.
969,A fast computer would be preferrable.
970,I am in need of a new computer that comes with high HDD capacity and low price.
971,I am trying to find a new computer that is reasonably priced.
972,I want to have a computer that would fit into my bag.
973,"For a light use of laptop, I am finding one that runs quickly with a low cost."
974,Price is what I consider when buying a new computer.
975,I am buying a new laptop for my daughter's graduation and it should be fast and have beautiful colours.
976,I am new to laptop so there should be easy installation and loading.
977,I am looking for a computer with high performance-cost ratio.
978,I need a fast computer.
979,I am working to find the best price for the best computer.
980,I am going to find a new computer for long-term use.
981,I am a middle-aged man and I have lower requirements on electrical device.
982,I would like to have a cute laptop with nice design and powerful processor.
983,I need to buy my wife a new computer and she wants it to be run fast and cool.
984,I depend on reliable resources to make up my decision on a new computer.
985,I don't want to borrow my husband's computer everytime I need it so I am finding myself a new computer with a nice hard drive.
986,I want some good-looking computer with good price.
987,"As a college student, I am finding an affordable laptop which has a solid construction."
988,I don't have much requirement on my new computer but I want it to be easy to setup.
989,I am finding a family laptop for my home and I want one that come with high performance-cost ratio.
990,I am looking for a replacement of my old computer which I require it to have a high performance-cost ratio.
991,I am using the new laptop to take appointment with my clients and I need it to startup fast and have good processor and SSD.
